{
  "schemaVersion": 1,
  "asOfDate": "2026-11-01",
  "dimensions": [
    "readability",
    "warmth",
    "directness",
    "absenceOfAiIsms",
    "toneAdherence",
    "factualRestraint"
  ],
  "weights": {
    "readability": 1,
    "warmth": 1,
    "directness": 1,
    "absenceOfAiIsms": 1,
    "toneAdherence": 1,
    "factualRestraint": 1
  },
  "records": [
    {
      "id": "seed-gpt-6-astra-de",
      "modelId": "gpt-6-astra",
      "cliId": "codex",
      "language": "de",
      "thinkingLevel": "unspecified",
      "status": "provisional",
      "scores": {
        "readability": null,
        "warmth": null,
        "directness": null,
        "absenceOfAiIsms": null,
        "toneAdherence": null,
        "factualRestraint": null
      },
      "overall": null,
      "costPerSampleUsd": null,
      "notes": "Research-informed evidence gap: these studies inform the rubric, but do not measure this exact model/language/thinking-level combination. Await Voice Lint; no numeric extrapolation.",
      "evidence": [
        {
          "kind": "study",
          "reference": "https://aclanthology.org/2024.emnlp-main.519/",
          "observedAtUtc": "2026-09-25T00:00:00Z",
          "note": "Use multiple dimensions and human spot checks; not a score for any seeded model."
        },
        {
          "kind": "study",
          "reference": "https://aclanthology.org/2024.tacl-1.24/",
          "observedAtUtc": "2026-09-25T00:00:00Z",
          "note": "Assess readability and factual restraint separately; no exact-model transfer."
        },
        {
          "kind": "study",
          "reference": "https://arxiv.org/abs/2404.04475",
          "observedAtUtc": "2026-09-25T00:00:00Z",
          "note": "Balance lengths and randomize blinded comparisons; preference scores are not our six-dimension rubric."
        },
        {
          "kind": "study",
          "reference": "https://www.nature.com/articles/s41586-026-10410-0",
          "observedAtUtc": "2026-09-25T00:00:00Z",
          "note": "Keep a factual-restraint floor alongside warmth; these fine-tuned models are not the catalogue models."
        },
        {
          "kind": "study",
          "reference": "https://aclanthology.org/2024.ltedi-1.9/",
          "observedAtUtc": "2026-09-25T00:00:00Z",
          "note": "Evaluate German separately across text genres; plain friendly language is not an Easy German certification."
        }
      ]
    },
    {
      "id": "seed-gpt-6-astra-en",
      "modelId": "gpt-6-astra",
      "cliId": "codex",
      "language": "en",
      "thinkingLevel": "unspecified",
      "status": "provisional",
      "scores": {
        "readability": null,
        "warmth": null,
        "directness": null,
        "absenceOfAiIsms": null,
        "toneAdherence": null,
        "factualRestraint": null
      },
      "overall": null,
      "costPerSampleUsd": null,
      "notes": "Research-informed evidence gap: these studies inform the rubric, but do not measure this exact model/language/thinking-level combination. Await Voice Lint; no numeric extrapolation.",
      "evidence": [
        {
          "kind": "study",
          "reference": "https://aclanthology.org/2024.emnlp-main.519/",
          "observedAtUtc": "2026-09-25T00:00:00Z",
          "note": "Use multiple dimensions and human spot checks; not a score for any seeded model."
        },
        {
          "kind": "study",
          "reference": "https://aclanthology.org/2024.tacl-1.24/",
          "observedAtUtc": "2026-09-25T00:00:00Z",
          "note": "Assess readability and factual restraint separately; no exact-model transfer."
        },
        {
          "kind": "study",
          "reference": "https://arxiv.org/abs/2404.04475",
          "observedAtUtc": "2026-09-25T00:00:00Z",
          "note": "Balance lengths and randomize blinded comparisons; preference scores are not our six-dimension rubric."
        },
        {
          "kind": "study",
          "reference": "https://www.nature.com/articles/s41586-026-10410-0",
          "observedAtUtc": "2026-09-25T00:00:00Z",
          "note": "Keep a factual-restraint floor alongside warmth; these fine-tuned models are not the catalogue models."
        }
      ]
    },
    {
      "id": "seed-gpt-6-sol-de",
      "modelId": "gpt-6-sol",
      "cliId": "codex",
      "language": "de",
      "thinkingLevel": "unspecified",
      "status": "provisional",
      "scores": {
        "readability": null,
        "warmth": null,
        "directness": null,
        "absenceOfAiIsms": null,
        "toneAdherence": null,
        "factualRestraint": null
      },
      "overall": null,
      "costPerSampleUsd": null,
      "notes": "Research-informed evidence gap: these studies inform the rubric, but do not measure this exact model/language/thinking-level combination. Await Voice Lint; no numeric extrapolation.",
      "evidence": [
        {
          "kind": "study",
          "reference": "https://aclanthology.org/2024.emnlp-main.519/",
          "observedAtUtc": "2026-09-25T00:00:00Z",
          "note": "Use multiple dimensions and human spot checks; not a score for any seeded model."
        },
        {
          "kind": "study",
          "reference": "https://aclanthology.org/2024.tacl-1.24/",
          "observedAtUtc": "2026-09-25T00:00:00Z",
          "note": "Assess readability and factual restraint separately; no exact-model transfer."
        },
        {
          "kind": "study",
          "reference": "https://arxiv.org/abs/2404.04475",
          "observedAtUtc": "2026-09-25T00:00:00Z",
          "note": "Balance lengths and randomize blinded comparisons; preference scores are not our six-dimension rubric."
        },
        {
          "kind": "study",
          "reference": "https://www.nature.com/articles/s41586-026-10410-0",
          "observedAtUtc": "2026-09-25T00:00:00Z",
          "note": "Keep a factual-restraint floor alongside warmth; these fine-tuned models are not the catalogue models."
        },
        {
          "kind": "study",
          "reference": "https://aclanthology.org/2024.ltedi-1.9/",
          "observedAtUtc": "2026-09-25T00:00:00Z",
          "note": "Evaluate German separately across text genres; plain friendly language is not an Easy German certification."
        }
      ]
    },
    {
      "id": "seed-gpt-6-sol-en",
      "modelId": "gpt-6-sol",
      "cliId": "codex",
      "language": "en",
      "thinkingLevel": "unspecified",
      "status": "provisional",
      "scores": {
        "readability": null,
        "warmth": null,
        "directness": null,
        "absenceOfAiIsms": null,
        "toneAdherence": null,
        "factualRestraint": null
      },
      "overall": null,
      "costPerSampleUsd": null,
      "notes": "Research-informed evidence gap: these studies inform the rubric, but do not measure this exact model/language/thinking-level combination. Await Voice Lint; no numeric extrapolation.",
      "evidence": [
        {
          "kind": "study",
          "reference": "https://aclanthology.org/2024.emnlp-main.519/",
          "observedAtUtc": "2026-09-25T00:00:00Z",
          "note": "Use multiple dimensions and human spot checks; not a score for any seeded model."
        },
        {
          "kind": "study",
          "reference": "https://aclanthology.org/2024.tacl-1.24/",
          "observedAtUtc": "2026-09-25T00:00:00Z",
          "note": "Assess readability and factual restraint separately; no exact-model transfer."
        },
        {
          "kind": "study",
          "reference": "https://arxiv.org/abs/2404.04475",
          "observedAtUtc": "2026-09-25T00:00:00Z",
          "note": "Balance lengths and randomize blinded comparisons; preference scores are not our six-dimension rubric."
        },
        {
          "kind": "study",
          "reference": "https://www.nature.com/articles/s41586-026-10410-0",
          "observedAtUtc": "2026-09-25T00:00:00Z",
          "note": "Keep a factual-restraint floor alongside warmth; these fine-tuned models are not the catalogue models."
        }
      ]
    },
    {
      "id": "seed-gpt-6-luna-de",
      "modelId": "gpt-6-luna",
      "cliId": "codex",
      "language": "de",
      "thinkingLevel": "unspecified",
      "status": "provisional",
      "scores": {
        "readability": null,
        "warmth": null,
        "directness": null,
        "absenceOfAiIsms": null,
        "toneAdherence": null,
        "factualRestraint": null
      },
      "overall": null,
      "costPerSampleUsd": null,
      "notes": "Research-informed evidence gap: these studies inform the rubric, but do not measure this exact model/language/thinking-level combination. Await Voice Lint; no numeric extrapolation.",
      "evidence": [
        {
          "kind": "study",
          "reference": "https://aclanthology.org/2024.emnlp-main.519/",
          "observedAtUtc": "2026-09-25T00:00:00Z",
          "note": "Use multiple dimensions and human spot checks; not a score for any seeded model."
        },
        {
          "kind": "study",
          "reference": "https://aclanthology.org/2024.tacl-1.24/",
          "observedAtUtc": "2026-09-25T00:00:00Z",
          "note": "Assess readability and factual restraint separately; no exact-model transfer."
        },
        {
          "kind": "study",
          "reference": "https://arxiv.org/abs/2404.04475",
          "observedAtUtc": "2026-09-25T00:00:00Z",
          "note": "Balance lengths and randomize blinded comparisons; preference scores are not our six-dimension rubric."
        },
        {
          "kind": "study",
          "reference": "https://www.nature.com/articles/s41586-026-10410-0",
          "observedAtUtc": "2026-09-25T00:00:00Z",
          "note": "Keep a factual-restraint floor alongside warmth; these fine-tuned models are not the catalogue models."
        },
        {
          "kind": "study",